ticket_id,description,category,priority
182,Important: Getting a generic error in the main view. This happened after yesterday. Production is impacted. Sorry for the trouble. Hope you're having a good day.,Technical,High
183,Routine: How do I modify the alert system? I am not seeing any updates. Production is impacted.,Account,Medium
184,Urgent: There is a glitches when I save changes. This is very annoying. Sent from my iOS.,Technical,High
185,ASAP: The view logs level is insufficient for my security settings. It keeps hangs. Best regards. Best regards. Thanks for the help.,Account,High
186,Important: The auth settings are acting strange. I need to set up my profile data. This is blocking my work.,Account,High
187,How do I set up the alert system? I am not seeing any updates. Need this fixed soon. Thanks for the help. Sent from my iPhone.,Account,High
188,Why is there a discrepancy in the latest charge? It says order #55 but the amount is different. It's a critical blocker.,Billing,Medium
189,ASAP: The token is not appearing as expected in the portal. Can you cehck the client app logs? Production is impacted.,Technical,High
190,Question: The latest charge from the last update seems higher than expected. I checked the details and it looks okay. Thanks for the help.,Billing,Medium
191,I was expecting a PDF file but I received a notification about stuck. This is blocking my work.,Billing,High
192,Routine: I was expecting a PDF file but I received a notification about stuck. Urgent attention needed.,Billing,Medium
193,I am having trouble with keys when I try to sign in. Hope you're having a good day.,Account,Critical
194,The verification settings are not responding correctly. I need to reset my security settings. This is blocking my work. Sent from my iPhone. Best regards.,Account,High
195,The portal is not responding correctly. I was trying to sync but it just returns an error. Thanks for the help.,Technical,Critical
196,"Update: My contact email is showing as inactive. Also, the navigation layer feels degraded. Best regards. Sorry for the trouble. Hope you're having a good day.",Account,Medium
197,The add-on process did not behave as expected and not what I agreed to. Thanks for the help. Sorry for the trouble. Sent from my iPhone.,Billing,Medium
198,The add-on process did not behave as expected and unusually high. Hope you're having a good day. Hope you're having a good day. Sorry for the trouble.,Billing,Medium
199,"Urgent: I noticed the navigation layer is showing inconsistencies on web browser. Also, and check my refund. Sent from my iPhone. Hope you're having a good day. Sorry for the trouble.",Technical,High
200,The feature process did not behave as expected and higher than expected. Sorry for the trouble.,Billing,High
201,HELP FAST: Getting a timeout in the main view. This happened after the last update. This is blocking my work.,Technical,Critical
202,The plan process did not behave as expected and showing twice. Sorry for the trouble.,Billing,Medium
203,Getting a internal error in the navigation layer. This happened after this morning. Production is impacted.,Technical,Medium
204,By Monday: The latest charge from my last login seems higher than expected. I checked the details and it looks okay. Thanks for the help.,Billing,High
205,The sign in level is insufficient for my profile data. It keeps glitches. Thanks for the help. Sorry for the trouble. Thanks for the help.,Account,High
206,HELP FAST: I was expecting a receipt but I received a notification about not going through. This is blocking my work.,Billing,Critical
207,The update profile level is insufficient for my contact email. It keeps stops working. Sent from my iPhone.,Account,Low
208,Needs checking: There is a fails to complete when I upload data. This is a major issue. Sent from my Android. Best regards. Sorry for the trouble.,Technical,High
209,Routine: I am having trouble with authentication info when I try to view logs. Sorry for the trouble. Sorry for the trouble. Hope you're having a good day.,Account,Medium
210,How do I review the email system? I am not seeing any updates. Need this fixed soon.,Account,Critical
211,The add-on process did not behave as expected and not what I agreed to. Best regards. Hope you're having a good day. Best regards.,Billing,Critical
212,The sign in level is insufficient for my profile data. It keeps hangs. Hope you're having a good day.,Account,Medium
213,Follow up: The SAML settings are degraded. I need to set up my login information. Urgent attention needed.,Account,Medium
214,Question: There is a returns an error when I sync. This is preventing progress. Sent from my client app.,Technical,Medium
215,Urgent: The auth settings are showing inconsistencies. I need to reset my contact email. Urgent atention needed.,Account,High
216,URGENT: Why is there a discrepancy in the summary? It says INV-202 but the amount is different. It's a critical blocker. Best regards. Thanks for the help.,Billing,Critical
217,The token is not appearing as expected in the system. Can you check the Android logs? It's a critical blocker.,Technical,Low
218,"I noticed the navigaation layer is degraded on iOS. Also, but I have a billing question. Sent from my iPhone.",Technical,Low
219,"Maybe later: I noticed the settings area is showing inconsistencies on client app. Also, also my last payment failed. Hope you're having a good day.",Technical,Low
220,The module is acting strange. I was trying to save changes but it just fails to complete. Thanks for the help. Sorry for the trouble. Sent from my iPhone.,Technical,Critical
221,I was expecting a email notification but I received a notification about flagged. Urgent attntion needed. Sorry for the trouble. Thanks for the help.,Billing,Low
222,I am having trouble with keys when I try to sign in. Best regards.,Account,Low
223,"ASAP: I noticed the profile panel is acting strange on Android. Also, and the invoice is wrong. Best regards.",Technical,High
224,HELP FAST: The sign in level is insufficient for my login information. It keeps hangs. Best regards. Best regards. Thanks for the help.,Account,Critical
225,"My profile data is under review. Also, the side section feels behaving unexpectedly. Sorry for the trouble.",Account,Critical
226,IMMEDIATELY: The SAML settings are not loading properly. I need to modify my security settings. Need this fixed soon. Sent from my iPhone. Hope you're having a good day.,Account,Critical
227,Suggestion: The gateway is acting strange. I was tryig to access the feature but it just returns an error. Best regards.,Technical,Low
228,Update: How do I review the message system? I am not seeing any updates. This is blocking my work. Thanks for the help. Hope you're having a good day.,Account,Medium
229,Getting a unexpected response in the navigation layer. This happened after my last login. Urgent attention needed.,Technical,High
230,BLOCKER: Why is there a discreancy in the statement? It says order #55 but the amount is different. Urgent attention needed. Best regards. Sent from my iPhone.,Billing,Critical
231,Getting a generic error in the profile panel. This happened atfer my last login. Production is impacted.,Technical,Medium
232,Routine: The data entry is not appearing as expected in the dashboard. Can you check the desktop logs? It's a critical blocker.,Technical,Medium
233,BLOCKER: My transfer was flagged last night. I also have a question about contact email. Best regards.,Billing,Critical
234,Minor: The update profile level is insufficient for my profile data. It keeps returns an error. Sent from my iPhone.,Account,Low
235,"Follow up: My contact email is not accessible. Also, the profile panel feels acting strange. Hope you're having a good day.",Account,Medium
236,Getting a internal error in the main view. This happened after this morning. Need this fixed soon.,Technical,Low
237,URGENT: The invoice from this morning seems unusually high. I checked the details and it looks okay. Hope you're having a good day. Sorry for the trouble. Sent from my iPhone.,Billing,Critical
238,Query: I am having trouble with keys when I try to update profile. Sorry for the trouble. Sent from my iPhone. Best regards.,Account,Medium
239,NOW: The SAML settings are showing inconsistencies. I need to review my security settings. Production is impacted.,Account,Critical
240,Why is there a discrepancy in the summary? It says ref 99 but the amount is different. This is blocking my work.,Billing,High
241,FYI: The change settings level is insufficient for my contact email. It keeps stops working. Sorry for the trouble. Best regards. Sent from my iPhone.,Account,Low
242,IMMEDIATELY: Getting a handshake failure in the navigation layer. This happened after the last update. This is blocking my work.,Technical,Critical
243,Needs checking: There is a hangs when I submit. This is a major issue. Sent from my desktop. Sorry for the trouble. Hope you're having a good day.,Technical,High
244,BLOCKER: The latest charge from the last update seems unusually high. I checked the profile and it looks okay. Best regards. Sorry for the trouble. Hope you're having a good day.,Billing,Critical
245,IMMEDIATELY: The file is not appearing as expected in the portal. Can you check the client app logs? It's a critical blocker.,Technical,Critical
246,No hurry: The view logs level is insufficient for my login information. It keeps hangs. Sorry for the trouble.,Account,Low
247,The update profile level is insufficient for my contact email. It keeps fials to complete. Best regards.,Account,Low
248,I was expecting a confimration but I received a notification about denied. This is blocking my work.,Billing,Critical
249,"Routine: My contact email is under review. Also, the settings area feels behaving unexpectedly. Sent from my iPhone.",Account,Medium
250,Routine: The module is showing inconsistencies. I was trying to save changes but it just glitches. Thanks for the help.,Technical,Medium
251,"URGENT: I noticed the navigation layer is behaving unexpectedly on desktop. Also, also my last payment failed. Thanks for the help. Thanks for the help. Best regards.",Technical,Critical
252,"URGENT: I noticed the profile panel is not responding correctly on Android. Also, and check my refund. Sorry for the trouble.",Technical,Critical
253,Suggestion: I am having trouble with password credentials when I try to change settings. Sent from my iPhone. Thanks for the help. Best regards.,Account,Low
254,The summary from my last login seems unusually high. I checked the card info and it looks okay. Hope you're having a good day.,Billing,Critical
255,The latest charge from the weekend seems not what I agreed to. I checked the card info and it looks okay. Hope you're having a good day.,Billing,Low
256,Follow up: Why is there a discrepancy in the summary? It says order #55 but the amount is different. It's a critical blocker.,Billing,Medium
257,The change settings level is insufficient for my profile data. It keeps hangs. Sorry for the trouble.,Account,High
258,"I noticed the navigation layer is not responding correctly on client app. Also, and the invoice is wrong. Hope you're having a good day.",Technical,Medium
259,Important: Getting a handshake failure in the main view. This happened after this morning. Need this fixed soon.,Technical,High
260,Query: The feature process did not behave as expected and unusually high. Sorry for the trouble.,Billing,Medium
261,The feature process did not behave as expected and unusually high. Best regards.,Billing,Low
262,"Routine: My login information is under review. Also, the navigation layer feels not responding correctly. Hope you're having a good day.",Account,Medium
263,ASAP: How do I check the alert system? I am not seeing any updates. It's a critical blocker.,Account,High
264,"I noticed the side section is degraded on Android. Also, and check my refund. Best regards.",Technical,High
265,The item is not appearing as expected in the portal. Can you check the desktop logs? Production is impacted. Best regards. Sent from my iPhone.,Technical,Low
266,I was expecting a receipt but I received a notification about denied. It's a critical blocker.,Billing,Critical
267,The gateway is not responding correctly. I was trying to upload data but it just glitches. Sorry for the trouble. Sent from my iPhone. Hope you're having a good day.,Technical,Low
268,The item is not appearing as expeted in the module. Can you check the iOS logs? Need this fixed soon.,Technical,Critical
269,Question: Why is there a discrepancy in the latest charge? It says INV-202 but the amount is different. This is blocking my work. Thanks for the help. Best regards.,Billing,Medium
270,The dashboard is degraded. I was trying to save changes but it just fails to complete. Hope you're having a good day.,Technical,Medium
271,Urgent: My transfer was flagged last night. I also have a question about contact email. Sent from my iPhone.,Billing,High
272,No hurry: The invoice from the last update seems not what I agreed to. I checked the profile and it looks okay. Sent from my iPhone.,Billing,Low
273,Routine: The sign in level is insufficient for my contact email. It keeps returns an error. Sorry for the trouble.,Account,Medium
274,Routine: There is a returns an error when I upload data. This is frustrating. Sent from my desktop. Hope you're having a good day. Thanks for the help.,Technical,Medium
275,ASAP: The record is not appearing as expected in the portal. Can you check the web browser logs? Production is impacted.,Technical,High
276,The plan process did not behave as expected and showing twice. Thanks for the help. Best regards. Thanks for the help.,Billing,High
277,The gateway is not responding correctly. I was trying to save changes but it just returns an error. Sent from my iPhone.,Technical,Critical
278,The invoice from my last login seems incorrect. I checked the card info and it looks okay. Sent from my iPhone.,Billing,High
279,How do I modify the alert system? I am not seeing any updates. It's a critical blocker.,Account,Low
280,By Monday: I am having trouble with password credentials when I try to change settings. Sent from my iPhone.,Account,High
281,There is a returns an error when I submit. This is frustrating. Sent from my Android. Hope you're having a good day. Thanks for the help.,Technical,Medium
282,NOW: The summary from yesterday seems not what I agreed to. I checked the card info and it looks okay. Thanks for the help.,Billing,Critical
283,I was expecting a email notification but I received a notification about denied. It's a critical blocker.,Billing,High
284,NOW: My PayPal was not going through last night. I also have a question about security settings Sorry for the trouble.,Billing,Critical
285,Important: The system is degraded. I was trying to upload data but it just glitches. Thanks for the help.,Technical,High
286,HELP FAST: The data entry is not appearing as expceted in the system. Can you check the web browser logs? Need this fixed soon. Thanks for the help. Hope you're having a good day.,Technical,Critical
287,IMMEDIATELY: Getting a handshake failure in the main view. This happened after this morning. Production is impacted.,Technical,Critical
288,I am having trouble with authentication info when I try to update profile. Best regards.,Account,Medium
289,Why is there a discrepancy in the latest charge? It says order #55 but the amount is different. It's a critical blocker.,Billing,High
290,Why is there a discrepancy in the summary? It says INV-2022 but the amount is different. Production is impacted. Hope you're having a good day. Sorry for the trouble.,Billing,Low
291,There is a fails to complete when I proceed. This is very annoying. Sent from my Android.,Technical,High
292,Maybe later: The data entry is not appearing as expected in the system. Can you check the Android logs? Production is impacted. Sent from my iPhone. Hope you're having a good day.,Technical,Low
293,HELP FAST: My PayPal was not going through last night. I also have a quetion about security settings. Thanks for the help.,Billing,Critical
294,Suggestion: I am having trouble with keys when I try to change settings. Thankss for the help.,Account,Low
295,Query: The system is behaving unexpectedly. I was trying to access the feature but it just returns an error. Sent from my iPhone. Hope you're having a good day. Thanks for the help.,Technical,Medium
296,BLOCKER: The statement from this morning seems showing twice. I checked the card info and it looks okay. Best regards.,Billing,Critical
297,Update: Why is there a discrepancy in the latest charge? It says INV-202 but the amount is different. It's a critical blocker.,Billing,Medium
298,I am having trouble with keys when I try to view logs. Sorry for the trouble.,Account,Low
299,The SAML settings are showing inconsistencies. I need to check my contact email. This is blocking my work. Thanks for the help. Sent from my iPhone.,Account,Medium
300,My PayPal was denied last night. I also have a questio about login information. Sorry for the trouble. Hope you're having a good day. Sent from my iPhone.,Billing,Medium
301,Getting a timeout in the side section. This happened after this morning. It's a critical blocker. Thanks for the help. Sorry for the trouble.,Technical,Medium
302,ASAP: Why is there a discrepancy in the statement? It says order #55 but the amount is different. This is blocking my work. Sorry for the trouble. Thanks for the help.,Billing,High
303,How do I check the email system? I am not seeing any updates. Need this fixed soon. Thanks for the help. Best regards.,Account,Medium
304,NOW: The update profile level is insufficient for my security settings. It keeps fails to complete. Sent from my iPhone.,Account,Critical
305,The entry is not appearing as expected in the portal. Can you check the iOS logs? Need this fixed soon. Best regards. Sorry for the trouble.,Technical,Low
306,No hurry: Getting a unexpected response in the navigation layer. This happened after the last update. This is blocking my work.,Technical,Low
307,Needs checking: The entry is not appearing as expected in the gateway. Can you check the iOS logs? It's a critical blocker.,Technical,High
308,I was expecting a confirmation but I received a notification about not going through. This is blocking my work.,Billing,Low
309,By Monday: The item is not appearing as expected in the system. Can you check the iOS logs? It's a critical blocker.,Technical,High
310,"I noticed the navigation layer is behaving unexpectedly on web browser. Also, but I have a billing question. Sorry for the trouble.",Technical,Critical
311,The invoice from the weekend seems incorrect. I checked the card info and it looks okay. Hope you're having a good day.,Billing,Low
312,The change settings level is insufficient for my profile data. It keeps hangs. Thanks for the help. Sorry for the trouble. Sent from my iPhone.,Account,Low
313,How do I modify the email system? I am not seeing any updates. It's a critical blocker.,Account,Critical
314,The SAML settings are behaving unexpectdly. I need to modify my contact email. Urgent attention needed.,Account,Critical
315,The view logs level is insufficient for my security settings. It keeps glitches. Hope you're having a good day.,Account,Low
316,I am having trouble with authentication info when I try to change settings. Hope you're having a good day.,Account,Critical
317,By Monday: Why is there a discrepancy in the latest charge? It says INV-202 but the amount is different. It's a critical blocker.,Billing,High
318,Important: I am having trouble with password credentials when I try to sign in. Hope you're having a good day.,Account,High
319,Update: Getting a status code 500 in the side section. This happened after the weekend. Need this fixed soon.,Technical,Medium
320,"I noticed the profile panel is not responding correctly on iOS. Also, but I have a billing question. Hope you're having a good day. Thanks for the help. Sorry for the trouble.",Technical,Low
321,IMMEDIATELY: The data entry is not appearing as expected in the system. Can you check the Android logs? This is blocking my work.,Technical,Critical
322,CRITICAL: I am having trouble with authentication info when I try to update profile. Hope you'r having a good day.,Account,Critical
323,Follow up: Getting a internal error in the esttings area. This happened after my last login. Production is impacted.,Technical,Medium
324,Suggestion: I was expecting a confirmation but I received a notification about stuck. It's a critical blocker.,Billing,Low
325,"BLOCKER: My login informaion is locked. Also, the profile panel feels acting strange. Sent from my iPhone.",Account,Critical
326,"My contact email is under review. Also, the profile panel feels not responding correctly. Thanks for the help.",Account,Low
327,FYI: The entry is not appearing as expected in the interface. Can you check the desktop logs? This is blocking my work.,Technical,Low
328,"URGENT: I noticed the profile panel is not loading properly on Android. Also, and the invoice is wrong. Sorry for the trouble.",Technical,Critical
329,"Minor: My security settings is not accessible. Also, the profile pnel feels degraded. Sorry for the trouble.",Account,Low
330,The MFA settings are degraded. I need to set up my profile data. Urgent attention needed.,Account,Low
331,Question: Why is there a discrepancy in the summary? It says ref 99 but the amount is different. Producction is impacted.,Billing,Medium
332,"No hurry: My profile data is showing as inactive. Also, the settings area feels acting strange. Hope you're having a good day.",Account,Low
333,Urgent: The verification settings are behaving unexpectedly. I need to modify my login information. It's a critical blocker. Sent from my iPhone. Sorry for the trouble.,Account,High
334,By Monday: I am having trouble with authenticaation info when I try to sign in. Best regards.,Account,High
335,CRITICA:L The view logs level is insufficient for my contact email. It keeps fails to complete. Best regards.,Account,Critical
336,The dashboard is showing inconsistencies. I was trying to sync but it just fails to complete. Sent from my iPhhone.,Technical,Medium
337,Important: The MFA settings are degraded. I need to check my login information. It's a critical blocker.,Account,High
338,NOW: The dashboard is behaving unexpectedly. I was trying to sync but it just glitches. Sorry for the trouble. Thanks for the help. Hope you're having a good day.,Technical,Critical
339,The record is not appearing as expected in the dashboard. Can you check the desktop logs? It's a critical blocker. Sorry for the trouble. Hope you're having a good day.,Technical,High
340,"Update: I noticed the profile panel is not loading properly on Android. Also, and the invoiec is wrong. Sorry for the trouble. Hope you're having a good day. Best regards.",Technical,Medium
341,My PayPal was not going through last night. I also have a question about contact email. Thanks for the help.,Billing,Medium
342,Needs checking: Why is there a discrepancy in the invoice? It says TXN-101 but the amount is different. It's a critical blocker.,Billing,High
343,ASAP: The token is not appearing as expected in the system. Can you check the client app logs? It's a critical blocker. Sorry for the trouble. Hope you're having a good day.,Technical,High
344,Getting a timeout in the main view. This happened after the last update. It's a critical blocker.,Technical,Low
345,I was expecting a receipt but I received a notification aabout flagged. Urgent attention needed.,Billing,Medium
346,Query: Getting a generic error in the main view. This happened after my last login. Urgent attention needed.,Technical,Medium
347,Routine: Getting a handshake failure in the main view. This ahppened after yesterday. Urgent attention needed.,Technical,Medium
348,Why is there a discrepancy in the invoice? It says ref 99 but the amount is different. Urgent attention needed.,Billing,High
349,No hurry: I was expecting a PDF file but I received a notification about not going through. Urgent attention needed. Hope you're having a good day. Thanks for the help.,Billing,Low
350,FYI: I am having trouble with authentication info when I try to change settings. Best regards.,Account,Low
351,Suggestion: The feature process did not behave as expected and higher than expected. Best regards.,Billing,Low
352,Needs checking: Getting a status code 500 in the main view. This happened after the last update. This is blocking my work.,Technical,High
353,Urgent: The feature process did not behave as expected and shoing twice. Thanks for the help. Sent from my iPhone. Thanks for the help.,Billing,High
354,Urgent: There is a stops working when I access the feature. This is frustrating. Sent from my client app.,Technical,High
355,"My profile data is locked. Also, the main view feels degraded. Sent from my iPhone. Sent from my iPhone. Best regards.",Account,Low
356,Minor: The gateway is acting strange. I was trying to sync but it just glitches. Hope you're having a good day.,Technical,Low
357,There is a returns an error when I submit. This is very annoying. Sent from my Android.,Technical,Critical
358,My PayPal was denied last night. I also have a question about contact emaiil. Best regards.,Billing,Low
359,IMMEDIATELY: The token is not appearing as expected in the dashboard. Can you check the mobile device logs? Urgent attention needed.,Technical,Critical
360,The summary from yesterday seems not what I agreed to. I checked the card info and it looks okay. Thanks for the help.,Billing,Low
361,Suggestion: The summary from this morning seems showing twice. I checked the details and it looks okay. Thanks for the help.,Billing,Low
362,The gateway is acting strange. I was trying to access the feature but it just stops working. Sorry for the trouble. Hope you're having a good day. Thanks for the help.,Technical,High
